ID,text,target
train_5088,Hello Rubika Ji How are you Hope you and your family are fine and safe I am from Navi Mumbai Koparkhairane Pin No 400709 area My question is that why ABP news is not showing more details news about  in our Navi Mumbai area,1
train_5089,My husband works at a hospital Today he s getting tested for We ve been quarantined except for his work and essential shopping for over a month Today guys,1
train_5090,Every night in Ramadan Allah chooses people to be saved from the hellfire,0
train_5091,Chinese police detain two people who contributed to an online archive of censored articles about the outbreak ht,1
train_5092,WitchfordVC C PettiforPE Challenge Lovely to see some awesome entries this morning Lots of you are embracing the Virtual Sports Week Challenges too Updated scores will be released every evening Keep being active Witchf,0
train_5093,The goal is to khatam Quran within Ramadan,0
train_5094,Total death rates have spiked in several countries due to Imagine how this would have continued without countermeas,1
train_5095,imgflip has a deep learning neural network meme text generator It takes an image and adds text from what it has learned from existing memes pic twitter com 0SdmofhOH0,0
train_5096,The number of players drafted between Bama LSU amp Clemson speaks to coaching Automatic recruiting tool,0
train_5097,NEXT Has your idea of parenting gone out the window with  Trying to keep your kids busy for their waking hours,1
train_5098,censors material to protect Biden and now censors video because it might help,1
train_5099,Social distancing norms being violated in Raja Bazaar area in Kolkata West Bengal,1
train_5100,is intended to be given to people newly infected with  The VA study gave it to people alread,1
train_5101,1 2 I don t understand how the non working of centralised tracing apps on iPhones is spun as a problem that Apple has to f,1
train_5102,InShaaAllah this Ramadan boosts my iman to its highest level amp guides me to a permanent change,0
train_5103,It may look like the US is plateauing but realize this is the number of new DEATHS per day with bottlenecked testing,1
train_5104,Last week 110 MPs and Peers from seven parties lobbied the Chancellor for a Universal to help the UK,1
train_5105,Vents Seen a Somali girl get at Nella wishing death on her during Ramadan you know We can actually disagree without crossing a,0
train_5106,Jersey matchup Voting ends at 9 00 p m,0
train_5107,CM Uddhav Balasaheb Thackeray in an on going video conference with the Hon ble Prime Minister ji Union H,1
train_5108,Ramadan must be fasted by every sane and able adult Muslim who is not traveling,0
train_5109,It doesn t look particularly professional but at least I know it s protecting me Dr Gail Allsopp who kept a video diary wh,1
train_5110,Solidarity and Triumph of the Human Spirit in these Challenging Times,1
train_5111,Rosenthal One note I did not include in story Four of the last five pitchers to close out the Series Hudson Sale Morton Davis,0
train_5112,Sergio Ag ero has taken a jab at EA over s Ultimate Team packs Don t expect something from EA SPOS because,0
train_5113,DFFN Diffusion Pharmaceuticals Announces Pre IND Submission to the FDA of Design for TSC Trials to Treat Acute Respiratory Dis,1
train_5114,online Here is what they did when they came to my house got in knocked my mom went to speak to them they took off their mu,1
train_5115,Six Areas Where AI Is Improving Customer Experiences pic twitter com IV361nIyzu,0
train_5116,Tweets you were clicking and liking on last night you loon,0
train_5117,Sheldon Keefe to answer fan questions during virtual Algonquin College speaker series event Pembroke Daily Observer,0
train_5118,Could I be carrying the on the bottom of my shoes,1
train_5119,I wish Twitter had social distance guidelines for the reply guys some of you sure know how to ruin a tweet with your dum,0
train_5120,Interesting Peer Reviewing Data Science Projects Read More Here,0
train_5121,Mark Grenon a Florida church leader who is being prosecuted by the DOJ for pushing bleach as a  miracle cure se,1
train_5122,995 Sh t it s Ramadan,0
train_5123,You are rewarded for eating in Ramadan and nourishing your body when it s vulnerable in this state You re rewarded for the f,0
train_5124,Dear nurses on the TL use this to make money the highest paying States now are NY and DMV has always you only need,1
train_5125,MercyOfAllah O son of Adam If you come to me with enough mistakes to fill the Earth and meet Me without associating,0
train_5126,Just caught rainbows in Rawalpindi MercyOfAllah,0
train_5127,I haven t been on Twitter much for the past week since my landlord s gone against the non statutory play fairly old chap n,1
train_5128,I think you can find this useful Making Backpropagation Autograd MNIST Classifier from scratch in Python,0
train_5129,NOLTE Top Joe Biden medical expert Dr Ezekiel Emanuel predicted America would hit a whopping 100 million,1
train_5130,UPDATE MUSLIMS CHOOSE TO KEEP MOSQUES CLOSED DURING RAMADAN IN LIGHT OF ,0
train_5131,We re grateful to the scientists managers data officers cleaners amp all working at the 15 molecular testing labs ac,1
train_5132,They did but only for dogs they are declared as life companions not as livestock or food,0
train_5133,Ramadan Mubarak to all our fellow Muslim ARMYs,0
train_5134,Since the road back to high level competitive sport is laden with many challenges we must adopt a strategic approach to m,0
train_5135,Dhanyawad for creating a personal bodyguard for every Indian to fight  h,1
train_5136,2499 flash King Chile Fuck anyone making fun of either 911 Harvey or any natural disaster If I see that shit on my timeline I m saying something We are all in this together Real shit comes before sports teams,0
train_5137,cj No offense but the disappearing before May actually sucks,1
train_5138,I think at least 25 of sports fans on twitter might actually have a mental illness,0
train_5139,Javeed Indian Council of Medical Research ICMR has asked states to stop using Wondfo testing kits Middlemen made mor,1
train_5140,MercyOfAllah Allah loves His Messengers and His believing servants and they love Him and nothing is more beloved to t,0
train_5141,For India 1st time in history the Muslim call to prayer will blast over loud speakers in Minneapolis 5 times a day during Ramada,0
train_5142,NYT s analysis of Trump s remarks about the By far the most recurring utterances from Mr Trump in the briefings,1
train_5143,I refuse to throw away all the effort and the sacrifice of the British people and to risk a second major outbreak and hu,1
train_5144,Am I in another universe The Prime Minister makes a Statement of complete Bollox we all know it s complete Bollox the,1
train_5145,show luv gonna try and get this going as a platform to talk sports and express opinions wld appreciate a follow http,0
train_5146,Rosenthal One note I did not include in story Four of the last five pitchers to close out the Series Hudson Sale Morton Davis,0
train_5147,I ve decided that I will go see my mans after Ramadan and the only think stopping me is if hell freezes over,0
train_5148,Catching up on some old ufc events wow cant wait for this one big shout bt sports u kept me going in the house 1 event a night sometimes 2 yessa yessa,0
train_5149,11 Visualizing during Right now increased stressors may lead us to feelings bubbling over This,1
train_5150,US woman found dead with 8ft python wrapped around her neck,0
train_5151,AI for People and Business a framework for success See the book here pic twitter com QFPyUe9M7a,0
train_5152,s administration knew that would outbreak even earlier than Chinese Government Evidence shows that,1
train_5153,Towards an Effective and Efficient Deep Learning Model for  Patterns Detection in X ray Images,0
train_5154,Modi govt wasted money on faulty Chinese tests ignoring Indian options Member of Parliament for,1
train_5155,Even from the most merciful Allah Ramadan is the best mercy of Allah SWT MercyOfAllah,0
train_5156,Lmao wasssssuppo dawgg,0
train_5157,The goal is to khatam Quran within Ramadan,0
train_5158,To summarize Sungjin s bag gt W500 000 USD408 Jae s glasses gt W1 000 000 USD816 Young K s table gt W1 200 000 USD980,1
train_5159,Reducing the carbon footprint of artificial intelligence pic twitter com 2HoeFh3Hb2,0
train_5160,Bill Gates saw the coming Here s his plan to beat it,1
train_5161,10s of people die in terrorist attack Tories The threat is so enormous we should kill millions spend billions amp shr,1
train_5162,my driving Here s what Fox said about were they right or wrong about ,1
train_5163,UK PM returns Boris Johnson gets back to work after recovering from,1
train_5164,Attempts to spin the UK response as a success are insulting Germany has a larger population but 6 000 deat,1
train_5165,A Ramadan Like No Other Images From Around the World by A Kashmiri man praying on the banks of Dal lake in Srin,0
train_5166,There are some so called higher caste people cheated in many forms the so called lower castes Some particular castes people engaged in business make use of and mercilessly cheat everybody I pray that Govt identify such people and take action I pray they die in,1
train_5167,Where s Putin Russia s president stays out of sight as hits economy,1
train_5168,Nah she did amazing You know how hard it is to calm a dog that s ready to attack AND be assertive while showing affection 99 of people wouldn t have been able to calm this dog down the way she did I applaud her bc I d be dead,0
train_5169,Yall will never admit it but the sports world owes so much love we made and take their games to a new level Detroit helped polish the,0
train_5170,Unconditional generosity is ingrained in the DNA To contribute to the fight against our new government i,1
train_5171,It was not the day btw,0
train_5172,How is this possible deaths Australia 83 New Zealand  Egypt 317 Kenya 14 South Africa 87 Argentin,1
train_5173,The syrup is just a well researched use of local herbs They didn t wait for WHO to accredit it before usi,1
train_5174,Benedict says Ramadan Kareem I love one Muslim man,0
train_5175,i m so mad i was thinking of that fat little food song,0
train_5176,The Pakistan Cricket Board on Monday handed a three year ban to for failing to report a spot fixing approach,0
train_5177,In 2017 a Palestinian judge banned divorce during Ramadan because people make hasty decisions when they re hungry,0
train_5178,Senegal has become the first country to make an order for Madagascar s medicine Organics,1
train_5179,This Ramadan A sensible powerful message from,0
train_5180,feels legalising ball tampering in the post world is a bit self contradictory while Proteas great is completely on the opposite end of the spectrum on a subject that has divided opinions,0
train_5181,74 MercyOfAllah The long hours without food and water should remind us of how fortunate we truly are to have an abun,0
train_5182,cj No offense but the disappearing before May actually sucks,1
train_5183,The longer time goes on the more I love my shark character Frankly I adore this artwork as well I LOVE the style so much Art by Im Scaredy Cat More info pic twitter com NE032rNqY0,0
train_5184,DFFN Diffusion Pharmaceuticals Announces Pre IND Submission to the FDA of Design for TSC Trials to Treat Acute Respirator,1
train_5185,1 2 LOOK Chi chi is the first animal in Manila given a frontliner ID for helping in the fight against the spread of,1
train_5186,MercyOfAllah Prophet Muhammad SAWW and his sahaba dedicated their days and nights for worship Their lives revolved c,0
train_5187,Delighted to announce UKCOGS UK amp Gynae Cancer Study Please do join Thx 2 all stakeholders supporters,1
train_5188,I put my palms out and together to ask Allah to grant us good health khayra shifa a blessings of this month Neima mercies of this month Rahmah goodness in this world and in the next I also asked Him to accept our Dua and forgive us our sins maghafirah Ameen Ramadan M,0
train_5189,Rudy Giuliani and K T McFarland Reveal the Sinister Reason Why China Claims the Came Out of a Wet Market Vid,1
train_5190,Handling a new baby during the pandemic,1
train_5191,The pandemic is going to take a greater toll on the conservative electorate leading into this election and that s simply ju,1
train_5192,Minister says  is empowering domestic violence abusers as rates rise in parts of Canada,1
train_5193,Introduction to Libraries used in Machine Learning pic twitter com sptu3igpru,0
train_5194,can you please put in some kind of rights for during such as reduced rent and reduced University fees,1
train_5195,A Redditor writes Why does the US denounce China on the one hand for draconian policies such as social credit which has been completely overblown and misunderstood but then want to institute similar things to keep up with the competition China is giving them in AI,0
train_5196,advice for women menstruating during Ramadan thread,0
train_5197,I lost my job and am caring for my grandparents we need money for food and gas so I can attempt to work and make money any help appreciated sarkiskhanishian,0
train_5198,How To Add Category Pages To A Blog With Django and Python,0
train_5199,A group of farmers and manufacturers have come together to thank the NHS and the farming industry for their efforts durin,1
train_5200,If trans girls were girls we wouldn t notice them in girls sports The very fact that we have eyes and can see them invalida,0
train_5201,Morgan class To keep the whole family active this afternoon you could set up a mini sports day or Olympics You may want to include,0
train_5202,Bill Gates says America s ability to safely and effectively lift restrictions will depend on its capacity to aggressiv,1
train_5203,The fuck s a bomboloni He raised a brow haaah ing at the mention of the food Whatever what you said Ya get what I mean,0
train_5204,Ryan Newman injured in fiery crash says he will be ready to race when NASCAR resumes,0
train_5205,West Wing Xenophobe Stephen Miller Gunning to Make Trump s Temporary Immigration Curb Long Term via,1
train_5206,T N  isolation wards to get robots,1
train_5207,MercyOfAllah The mercy of Allah SWT washes over everyone busy in worship and good deeds Bask in Allah SWT s mercy dur,0
train_5208,Bud it s not the neural network that s just a term used in machine learning You have no evidence that the Australian government is doing that at all so you re just spouting bullshit,0
train_5209,I m lucky to be in excellent company tomorrow at a seminar on Ethical Challenges of Sport Governance after  you,1
train_5210,HAPPENING NOW U K Prime Minister Boris Johnson makes statement after recovering from ,1
train_5211,I think the AI meme generator wrote National Treasure pic twitter com goHWR6DOK2,0
train_5212,BBC News Germans don compulsory masks as lockdown eases,1
train_5213,Today was the 4th interaction with CMs We continued discussions on  containing strategy as well as aspects relat,1
train_5214,This might be the last Ramadan in your life do your best,0
train_5215,The pandemic has closed many mental health residential centers sending residents home to families ill equipped for the challenges,1
train_5216,my ex classmate befire and during Ramadan,0
train_5217,One of this weekend s teams is looking at the problem of contamination through frequently touched surfaces Ha,1
train_5218,robberechts We created an interactive tool to explore how VAEP values player actions in soccer Try it out,0
train_5219,impacts online dairy ingredient foodservice sales,1
train_5220,Welp i better try and give her negative goe on her choreo sequence,0
train_5221,Prime Minister Boris Johnson on Monday made his first public appearance since being hospitalised with three weeks ago saying Britain was beginning to turn the tide on the outbreak but rejecting growing calls to ease a,1
train_5222,AAPG UPN SC would like to wish you Happy Ramadan 1441 H As the month of Ramadan starts talk respectfully treat others kindly walk modestly and pray sincerely May Allah bless and protect you from all sins May peace and joy be filled in your house Have a blessed Ramadan,0
train_5223,can i get 700 followers before tomorrow rt this and i will follow you but at the same time u must followback me okey tak s,0
train_5224,The has developed a Self Checker The online guide helps individuals make decisions and seek appropriate m,1
train_5225,The objective is to discuss the issues amp challenges faced by Industries of the State of Uttar Pradesh during the Nation wide resulting by the dreadful outbreak of amp devising the best way out to the challenges during this hour of crisis,1
train_5226,Why am I just now trying Ethiopian food for the first time,0
train_5227,Senegal has become the first country to make an order for Madagascar s medicine Organics,1
train_5228,Hungry dogs are never loyal,0
train_5229,HE WAS ASKING WHY SOME CARATS WERE FASTING AND I SAID IT WAS BC OF RAMADAN AND HE WAS LIKE RAMADAN WHATS RAMADAN,0
train_5230,zarBreezy I m teaching Qur an for charity this Ramadan For those that have not memorized up to Suratul Ammah DM me Pls coz you,0
train_5231,Global cases near 3 million John Hopkins UK PM to return amid pressure over strategy Italy details plans,1
train_5232,MercyOfAllah To attain Taqwa or righteousness means to fear Allah and to obey His every Command And by fasting fo,0
train_5233,club As we ve globalised and invaded natural habitats that s what s created the increased risk not the animals themselve,1
train_5234,Tomorrow I ll be interviewing Lexie Brown 4 if you have any questions you want me to ask her reply here fav foods Fav nba players Biggest transition from college to pros Toughest player to guard Overseas And whatever will be joining us again,0
train_5235,This bat hunter has spent ten years trying to prevent the next big pandemic by searching bat caves for new pathogens more spec,1
train_5236,Your VOTE IS your FREEDOM Do you trust your vote to Democrat supporting union controlled underpaid postal worker Do you beli,1
train_5237, Scientists conservationists urge public not to destroy bat habitats,1
train_5238,Governors say Trump s disinfectant comments prompted hundreds of poison center calls via,1
train_5239,isa i took my Grandma to the hospital this morning they told us that the Nephrologist is seeing patients and she was like k,1
train_5240,This keep feeding the needy as a priority The righteous are those who feed the poor the orphan and the,0
train_5241,A Dream Within a Dream via,0
train_5242,How to Create Graphic User Interfaces in Python Tutorial Learn IT Easy,0
train_5243,Thirdly you have been nothing less than supportive of Iykeresa on this street keep being that amazing person that you are I hope this puts a smile on your face Ramadan Mubarak,0
train_5244,260 000 words of self praise and not a single word of empathy for the victims,1
train_5245,Spending habits developed during the lockdown are set to permanently reshape consumer behaviour in Australia The parts of Australia which were lagging on online shopping are now in the ecosystem that s unlikely to change once this is over,1
train_5246,Wow Does Kevin McCarthy have a pair made of gold or what Wow This is spot on Kevin McCar,1
train_5247,Congratulations to for defending his dissertation Inferring the Evolutionary Histories of Stars and Their Planets Chapters on planet formation binary stars orbital dynamics stellar evolution and a machine learning code 100x faster than emcee Wow pic twitter com 6phhJrPIK9,0
train_5248,Reopen or not Missouri town divided as battered businesses cling to life,1
train_5249,Who influenced Kobe Lebron and AI oh yea it was Jordan,0
train_5250,How pissed would you be if none of these protesters get infected with Super pissed right,1
train_5251,Good news for Olympic sports and non revenue programs,0
train_5252,advice for women menstruating during Ramadan thread,0
train_5253,In Pictures Time to return Hong Kong police disperse protesters at shopping mall amid restrictions https,1
train_5254,Nancy Pelosi calls Joe Biden voice of reason on as she endorses him for president,1
train_5255, Collective Aid to Poor Families Continues Across Iran during Ramadan,0
train_5256,ICYMI Social distancing could force short term renovations to sports arenas with box section seats resembling old parks That would allow teams to control the separation and not affect sightlines architect Don Barnum told,0
train_5257,How to build a machine learning project in Elixir Erlang Solution blog,0
train_5258,Prisons across the world have become powerful breeding grounds for the prompting governments to release hundreds of thousands of inmates in a mad scramble to curb the spread of the contagion behind bars,1
train_5259,Allah never leaves us alone He always stays with us In our Happiness In our griefs To guide us and love us Happy Ramzan,0
train_5260,Nurses formed a guard of honour and clapped as six month old baby Erin was wheeled out of isolation was being treated at Alder Hey Children s Hospital in Liverpool in the UK where she battled  for two weeks since being diagnosed on April 10,1
train_5261,Don t ever stop sharing this video These idiots all blamed media hysteria for a so called hoax They are all respon,1
train_5262,The situation report for 26th April 2020 has been published Our daily situation reports provide a,1
train_5263,Social distancing could last months White House coordinator says,1
train_5264,6 added possible symptoms CDC,1
train_5265,Another Ramadan television series that has been the subject of wife controversy is one that depicts a family living i,0
train_5266,It d be cool if they had fans come and taste the food between a judge and a competitor I feel like judges judge the food based off of what THEY would do and not the personal style of that particular chef,0
train_5267,The president has reached Monty Python levels SHUFFLED OFF JOINED THE BLEEDIN CHOIR INVISIBLE THIS IS AN EX PANDEMIC,0
train_5268,Dear James please please highlight what 80 million hostages in have been through in past 41 yea,0
train_5269,ThreatsHub Cybersecurity News Singapore unveils winning 5G licensees TPG loses out on nationwide bid pic twitter com tIcQHhxIN6,0
train_5270,IN  Pandemic lockdown offers an unprecedented opportunity to shut TASMAC in perpetuity In India TN stands 1st i,1
train_5271,I have no doubt that we will beat this only if we stand together for a common fight Boris Johnson speaks for t,1
train_5272,4 considerations to leverage digital technologies through and beyond ,1
train_5273,Another interesting item 21 Jun 41 MEN and AFFAIRS ABOUT CATS,0
train_5274,What Senegal has done in the fight against  is a milestone in the fight against the in Africa all Senegale,1
train_5275,We would like to gather information on how Young Nephrologists in different regions are being affected by the c,1
train_5276,jcq yjf ggb xky lhg yka xfn pml njg cyr yrl tci mly orm gty hih jtp gae hdh ukc skl InsecureHBO CDTV  Prior Jorge Babu Manu ForaPrior David Mike Lindell Made In You My Pillow trump SUHO bizbizeyeteriz,1
train_5277,China to keep tests focused stops short of wider testing,1
train_5278,Tableeghi members who defeated Waiting to donate plasma This new pic came out from Delhi They don t spread,1
train_5279,faith1 Are the Muslims being held to this standard during Ramadan,0
train_5280,she s a copy cat bitch,0
train_5281,sassy How s this working out for you Any state discharging lawbreakers early should reconsider this Wouldn t y,1
train_5282,SOURCE SPOS 4 Hot Takes From WrestleMania 36,0
train_5283,UK Prime Minister Boris Johnson says there are real signs now we are passing through the peak of the outbreak t,1
train_5284,We re headed to 55 000 deaths in the month of April That s more than the average monthly death toll in the US,1
train_5285,Nearly a third of Americans believe in conspiracy theories Science explains why,1
train_5286,BCW s and Leina Warburton had a simple yet effective idea for the Global Call Out to Creatives to stop the spre,1
train_5287,Join CashApp BHDisasterRelief Sunday 11am it s with Chief Cat Grab ur PDF of the Biography of Kim Jong Suk available on request and make sure to bring ur for a great discussion pic twitter com RdHSwuNjnT,0
train_5288,PM releases details of end to lockdown May 4 manufacturing construction amp wholesale for cons,0
train_5289,To be honest The naps in Ramadan bang differently,0
train_5290,Bangladesh remains in as the pandemic continues leaving Muslims away from their loved ones during,0
train_5291,If you personally know someone who has tested positive for  retweet this People need to see how close it really,1
train_5292,I ve never had a better sports editor than Dan McGrath once my boss at the Chicago Tribune and not surprised at all that,0
train_5293,Apple Google rework tracking tech to address privacy concerns via,1
train_5294,Joey why don t you go off and get a good case of the and die,1
train_5295,Being groomed in your teens is fairly easy for teenagers bc in the tiny tiny world of your high school and your frien,0
train_5296,Futuristic Impacts of AI Over Businesses and Society,0
train_5297,I understand this is not essential but I was wondering if anyone in PA knows if dog groomers will be allowed to open up this week or next,0
train_5298,FIFA is to propose allowing five substitutions per game to deal with the congestion of matches likely to be caused by the outbreak according to reports Thoughts,0
train_5299,Together we can save lives,1
train_5300,Here s a slideshow of victims people who might have lived if you had a shred of competence W,1
train_5301,Up missing my clients and shooting with smile4meka  Baton Rouge Louisiana,1
train_5302,THREAD This thread summarizes the major media investigative reporting on the TRUMP CHINA SCANDAL a bribery scandal inv,1
train_5303,I used that stupid AI meme generator thing and pic twitter com ljxavm9Ouk,0
