ID,text,target
train_3403,Short version math predictors way off Actual data accurate  patient data in CA shows mortality rate similar to the flu,1
train_3404,How do I train my dog to stay pic twitter com sA8Jm2Wqg2,0
train_3405,Most American People did not vote for Donald Trump in 2016 Yet they are locked down with a malignant narcissist instead of protecting his people from  has amplified its lethality The USA Trump promised to make great again has never in its history seemed so pitiful,1
train_3406,throughout the lockdown I couldn t sleep the entire night I used to sleep at 6 in the morning but since Ramadan i feel so sleepy before isha i feel like skipping it and then when i am done my sleep goes away then i can t sleep till Fajr,0
train_3407,Journalist challenges C River Government over  free status Read Full Story at,1
train_3408,To help keep students and educators safe during the outbreak school closures have been extended to May 29 https,1
train_3409,WSJ s Kimberley Strassel Spygate Realities Media Failings amp the  Relief Bill Mess Whatfinger News Videos,1
train_3410,A simple way to explain the Recommendation Engine in AI by,0
train_3411,rami Videogame trivia even in 2020 Sonic remains the only primary protagonist in a major video game franchise that is known to f,0
train_3412,MercyOfAllah In verses three to five 5 of Surah Al Qadr God says The Night of Power is better than a thousand,0
train_3413,MercyOfAllah And We send down of the Qur an that which is healing and mercy for the believers but it does not incre,0
train_3414,Rep Castro says tax paying immigrants without Social Security numbers not receiving financial assistance during the,1
train_3415,Here he is eating haribo tangfastics in the Monty python docu Was cool to see him in awe of his heroes pic twitter com gOeaIz2D9p,0
train_3416,Update on the Lib Dem Ramadan Stunt fast thing Apparently the morons did it for one day only One day That s dedication fo,0
train_3417,LAW s IL Workshop s special online event Global Health Governance Sovereignty and Human Rights in the Shadow of 1,1
train_3418,President Magufuli we need leadership not prayers African Arguments,1
train_3419,For India 1st time in history the Muslim call to prayer will blast over loud speakers in Minneapolis 5 times a day during Ramada,0
train_3420,Cu Te No one can take away our Ramadan from us we just give it away ourselves And if we realize the utter blunder we have made we,0
train_3421,alher RAMADAN KAREEM May Allah accept our good deeds,0
train_3422,I personally know Dr Aniekeme Uwa Fine doctor Very professional We were both involved in the African Union Support to,1
train_3423,I can t keep up with all the critical redeployments of the UK Prime Minister s latest metaphor of  as an unexpect,1
train_3424,Kya galat bola unhone Even u shud cover yourself atleast in the holy month of Ramadan U ppl hv stopped reading Quran amp adopted the western attire Have u not read the importance of Burqa as per Quran Is there any differnc between u amp non believers if u don t follow Quran,0
train_3425,Hourly average speed test results DL Mb s 68 42 max 70 20 min 53 30 UL Mb s 20 10 max 20 30 min 20 00 Ping ms 25 20 max 26 00 min 24 72 Tests 89266,0
train_3426,Part 2 of our project Globe reporters share their ideas to improve sports via,0
train_3427,My quick take is that something really odd is going on with Ioannidis wrote Alexander Rubinsteyn a geneticist and computational biologist at in an email to Undark adding Pretty much no one with statistical acumen believes these studies,1
train_3428,I swear they keep making new symptoms for the every week something new is added,1
train_3429,This series of tweets and the frightening gap in time between all three must be posted on EVERY electronic billboard and,1
train_3430,New York Gov Andrew Cuomo is facing rising criticism over a directive in March requiring the state s nursing homes to a,1
train_3431,Then u should include things like equal pay in corporates on the basis of efficiency instead of gender And also women should themselves take active participation in areas that were reserved for physically strong persons such as sports or defence,0
train_3432,Day 44 Fuck you  Art has always been the raft onto which we climb to save our sanity I don t see a different pu,1
train_3433,Meanwhile our President is advising people to inject themselves with Mr Clean,1
train_3434,After hearing so many stories about people struggling right now it s hard to sit back and watch when you are so fortunate to be in position where you are healthy and safe,0
train_3435,Delhi HC Judgement has exposed huge corruption by Central Govt in procuring Test Kits Govt bought test kit at 600,1
train_3436,Going through that Willie Nelson list and some of these albums absolutely seem like a I fed 10 000 country albums to an AI meme pic twitter com HdSdQO6pf9,0
train_3437,My hands are sore bc sports my mood went downhill pretty fast,0
train_3438,Pakistan s Umar Akmal banned for 3 years from all forms of cricket for breaching anti corruption code,0
train_3439,News Silence is golden for as lockdown reduces noise,1
train_3440,teemerh Hadith of the day The Prophet said He who observes fasting during the month of Ramadan with Faith while seeking its re,0
train_3441,Lack of sleep hangover amp Dietz School are going to be a rough combination today,1
train_3442,Ramadan Mubarak to all our fellow Muslim ARMYs,0
train_3443,In an exclusive interview with Sky Sports Chelsea teenager Billy Gilmour reveals his footballing inspiration gives an in,0
train_3444,Merck the first company to bring an Ebola vaccine across the finish line has now officially stepped into the rac,1
train_3445,Bengals draft pick Tee Higgins responds to ESPN s graphic about his mother s addiction,0
train_3446,I think Trump s disinfectant injection therapy and light up the ass is going rather well so far Don t you,1
train_3447,Insights from the global financial crisis suggest that cash reserves at the time when a crisis hits determine the long term,1
train_3448,She Stunk She Couldn t See And She Bled All Over The Couch Kind People Save A Dying Dog And Her Transformation Is Incredible,0
train_3449,Our first June event Join us to construct a machine learning algorithm from scratch,0
train_3450,The chair of the House Subcommittee on Economic and Consumer Policy warns that a wild west of unregulated antibody tests are ent,1
train_3451,MercyOfAllah As the azan for Fajar prayer spreads in the air and brings the happiness of 1st holy fast May Allah bless you with joy and shower your home with love amp peace,0
train_3452,Ramadan Reminder TURN OFF TV EAT MODERATELY USE SOCIAL MEDIA WISELY READ QURAN DAILY PRAY MORE SALAH MAKE MORE DUA,0
train_3453,The PM says many are looking at the UK s apparent success in dealing with They aren t They are looking in h,1
train_3454,Artificial Intelligence AI Market in BFSI Sector 20 2023 Focus on Autonomous Banking to Boost Growth Technavio READ MORE,0
train_3455,And people are worried about sports restarting and easing the lockdown Give your heads a massive wobble Life before sport Always,0
train_3456,L Reed Murphy is a moron He was an unprepared fool from the moment he came into office Newark snowstorm and he still is The state was bankrupt before He is digging the hole deeper,1
train_3457,A Bigram Poem inspired by jobhunt ai therealreal is is searching searching for for Lead Lead Machine Machine Learning Learning Engineer Jobhunt ai,0
train_3458,Datta I think everyone from every party should trend after all he passed away while serving people in C,1
train_3459,Of course May Allah bless her forgive her sins and replace them with her best deeds show her straight path show her His Love for her accept her fasts in Ramadan,0
train_3460,in Brief Apr26 2020 NCRI ,0
train_3461,For those who d never invested in stocks crypto presented you with an opportunity to catch up to the bigger players I get the feeling that window is closing so you need to start making some real moves,1
train_3462,At 10 AM Shri will be interacting with state Chief Ministers via video conferencing They will be discussing a,1
train_3463,New machine learning algorithm reduces need for brain computer interfaces to undergo recalibration via xpress,0
train_3464,For India 1st time in history the Muslim call to prayer will blast over loud speakers in Minneapolis 5 times a day during Ramada,0
train_3465,Please remember that anyone can get and anyone can spread it Help save lives and protect the NHS by stayin,1
train_3466,What are indexers in C NET Ans Indexers are known as smart arrays in C It allows the instances of a class to be indexed in the same way as array,0
train_3467,Somebody should hand the PM a spade so he can bury the over 40k dead that his govt through incompetence arrogance and,1
train_3468,A very different and quieter Ramadan for Muslims around the world due to the pandemic Stunning pictures by,0
train_3469,Sweden is beating by letting it run its course quickly so herd immunity develops quickly,1
train_3470,Our EMTs walk directly into the face of danger every single day There s no way we could possibly repay them for their incr,1
train_3471,During a press conference Cali emergency room doctors told reporters that lockdown policies are not an appropriate re,1
train_3472,Former top public servant I won t download the app via,1
train_3473,Monty Python Life of Brian instead of General Studies whatever the hell that is supposed to be,0
train_3474,The  crisis has triggered growing calls for a Universal Basic Income I think it s a good idea but as I wrote in The Robots are Coming it should be tied to social work Now more than ever,1
train_3475,Real Time for Actionable Insights in Action On demand webinar by pic twitter com OEOPGK0HgT,0
train_3476,The situation report for 26th April 2020 has been published Our daily situation reports provide a,1
train_3477,Mohali on the path of recovery Five more patients including a 11 year old girl have recovered from the disease taking the tally of recovered patients to 27 in the district so far The active patients in Mohali have gone down to 34,1
train_3478,Understand Cross Entropy Loss in Minutes,0
train_3479,America first shipped lifesaving medical equipment to China as hospitals in the U S faced shortages Trump s complete betrayal left us tragically vulnerable to the and now we re paying the price,1
train_3480,25 years ago 4 27 95 beat 2 1,0
train_3481,s next power grab plans to use the and economic chaos they caused by,1
train_3482,Five employees at Costco store in Vaughan test positive for ,1
train_3483,New post A Silver Lining Less Driving Fewer Crashes,1
train_3484,A brand new weekly show every Monday The F1 Show brings you all the latest news updates and exclusive interviews fro,0
train_3485,Anyone think Trump will declare a national day of mourning for victims Yeah me neither,1
train_3486,True Experts after experts are saying the same thing In fact we have never been able to develop a vaccine for any of the Family which include SARS MERS some strains of common cold,1
train_3487,Free to read The death toll from may be almost 60 higher than reported in official counts according to a,1
train_3488,Even with their millions shared in the north they are still dying like chickens Ganduje waiting for 15B to fight Those people are weird,1
train_3489,With the rash of drunk driving in NS during and concern over an increase in violence to women over easy access to alcohol amp confined spaces what is the councilors concern over the Province not closing the NSLC I know it s a provincial matter not HRM,1
train_3490,O Lord forgive me all my sins small and great first and last open and secret Ameen,0
train_3491,China has much more population than USA but it is already controlled people can go out and have party now USA has almost 1 millions cases who makes that happened The only fact behind that is your government sucks thats s why they blame to China,1
train_3492,Nice article on and player Hannah Tingley who will be playing for Buffalo State Bengals SUNYA,0
train_3493,AMERICA HAS FREEDOM OF RELIGION UNLESS OF COURSE YOU ARE CHRISTIAN,0
train_3494,Indusind S Kathpalia is in full control NIMs at 4 25 Retail 56 of Loans PCR 63 up from 43 CI Ratio at 42 9 prov of 260 crs Total provisions over 2000 crs Net NPAs down to 91 ILFS fully provided for PL at 8000 including CC Recoveries at 95 in qtr,1
train_3495,Stay at home for Ramadan Only go outside for food health reasons or work but only if you cannot work from home If,0
train_3496,I wanna start a thread of just dad things because I just watched my dad use the dogs pooper scooper to whack weeds out of the ground in our yard,0
train_3497,No Ramadan bazaars less food wastage,0
train_3498,The Allegheny County Health Department says that there have been no new related deaths reported since Satu,1
train_3499,peruzzi First 100 people to retweet gets 5k each If it s too small for you don t participate we need only those people who genuinel,0
train_3500,katyal Joining Joe tmrw at 7 40 to talk about 2 impt things the tragedy of in our jails Trump claim to try to us,1
train_3501,The Prophet saw said The people will remain upon goodness as long as they hasten to break their fast MercyOfAllah,0
train_3502,FIFA has proposed allowing teams to make up to five substitutions per match to help players cope with the return to acti,1
train_3503,A statue of President Kennedy is a tougher amp smarter leader than,1
train_3504,RAMADAN S OFFER Hurry up and shop online all your favourite picks at bargain prices From noon Code NISN,0
train_3505,What do you call a joke with no punch line learning pic twitter com sRxHXC4lGO,0
train_3506,MercyOfAllah The Prophet sallallaahu alaihi wa sallam used to stay in I tikaaf seclusion in the Masjid for the pur,0
train_3507,Them Followers of Sant Rampal Ji Maharaj came forward during the crisis of epidemic Warehouse system for,1
train_3508,If you re wondering what this is it s a photo of doctors and nurses imitating Jesus last supper because apparently thei,1
train_3509,The has disrupted K 12 bars cities retail sports hotels airlines offices colleges subways concer,0
train_3510,no need to buy a weighted blanket if u have a sweet baby cat who lays on u while u do homework,0
train_3511,Most of the poor home in kaduna are already running without foodstuffs and it s Ramadan time Children already crying for,0
train_3512,Centre decides 2 withdraw faulty antibody test kits cancels import orders from China ICMR has asked state governments and UT s to stop using Guangzhou Wondfo Biotech and Zhuhai Livzon Diagnostics kits,1
train_3513,This series of tweets and the frightening gap in time between all three must be posted on EVERY electronic billboard and,1
train_3514,College students clamor for tuition refunds after shutters campuses,1
train_3515,Good evening Check out some ideas for centering our Muslim students during Ramadan Ramadan Considerations for T,0
train_3516,Viswanathan Anand Yuzvendra Chahal and others raise Rs 8 86 lakh for waste pickers community through online chess charity tournament chahal,0
train_3517,Senegal has become the first country to make an order for Madagascar s medicine Organics,1
train_3518,NYC Mayor Bill de Blasio threatened to permanently close churches but he s giving Muslims half a million meals for Ra,0
train_3519,Boston Dynamics is open sourcing its robot tech to help hospitals fight via,1
train_3520,stanDAY6 DAY6 on SBS Hope TV proceeds that will be donated to victims s bag 500 000won s glasses 1M won s signed,1
train_3521,Conservatives Want To Know Why Twitter Is Targeting Right Wing Misinfo While Giving China WHO A Pass,1
train_3522,bro if i don t get food in my system within the next hour i will wither away to nothing and that s on not eating all day,0
train_3523,12 Last time I d put up a post about respecting Ramadan I got a bunch of people responding with what business is that of yours and it doesn t bother us so why does it bother you and the likes That was in 7 Days Seems like ages ago,0
train_3524,AB SIRF 7 DIN REH GAYE HAIN LOCKDOWN BADHNE MAIN Guys please help the needy peoples in this wholy month of RAMADAN,0
train_3525,To the government of Cameroon let us prioritize our focus maybe today maybe tomorrow maybe next week or after we can do better than just requesting and spending trillions of Xaf We are able,1
train_3526,I don t know if I even have the words to say right now i m still so tired haha 36 325 raised for Hope from Home to fight,1
train_3527,Ya Allah Help me and make it easy for me to draw closer to you this Ramadan 1,0
train_3528,The Secretary of State says about Mahan Air This airline makes frequent trips to Venezuela to give unknown to the Maduro s To clarify in the last days some planes from landed at the Josefa Camejo ai,0
train_3529,AM1NAH PILI PILI Lamb and DETOX Paya Broths are ideal for intermittent fasting gut cleansing gut healing nourishment and more Sip it on its own during Ramadan add a garnish such cracked black pepper himalayan,0
train_3530,you can cat debug log pastebinit Sends data to pastebin for you cc surely you ve mentioned this at some point Also there s a gist command via CLI like WHAT Going to make creating support tickets for CLI scripts so much easier,0
train_3531,2650 IT S TIME TO TURN OFF THE MEDICAL INFO W BIRX amp FAUCI amp TURN ON THE OPTIMISTIC REOPENING OF AMERICA We want to hear our,1
train_3532,Machine Learning Necessary for Deep Learning pic twitter com YUwSbASg0L,0
train_3533,waseema Those who Fast with it s True Essence continue to benefit from it for Their Entire Lives His Holiness Hazrat Mirza,0
train_3534,boy Ganduje has spoken about how Federal Government abondoned Kano as well as not intervening to fight the  pandemic i,1
train_3535,Government school teacher to students I hope both of you get the I hope you both die a long painful d,1
train_3536,Despite Ramadan israel launches a pre dawn hostile airstrike on targets near to Syria s capital Damascus all missiles w,0
train_3537,Have you seen the response team in Kano Have you seen the acclaimed PPE they go around testing people with Why isn t there more labs considering the population of the state Oh I know you ll blame the fed govt and NCDC,1
train_3538,The AI meme generator did make some points here pic twitter com PicPE6d5Ct,0
train_3539,Italy s Prime Minister Giuseppe Conte confirmed that professional sports teams can resume training on May 18,0
train_3540,Brad has a food take that I agree with The simulation is officially broken,0
train_3541,working on extenuating bushfires so that does not extenuate,1
train_3542,Hopf he believes europe is in low single digits powering forward from low single digits to 60 exposed then seeing an effective anti viral that saved deaths in ICU or Germany conquer test and trace that would be condemned,1
train_3543,Downing Street bars Sunday Times journalists from posing questions during briefing,1
train_3544,Wait what Ramadan goes on for weeks Nobody mentioned that at Conference,0
train_3545,And instant banishment to a remote island with the guy who called his dick a moisture and heat seeking venomous throbbing python of love,0
train_3546,Plasma Jihad or Plasma terrorism As per reports 300 people from Tablighi Jamat have decided to donate plasma to severel,1
train_3547,UPDATE MUSLIMS CHOOSE TO KEEP MOSQUES CLOSED DURING RAMADAN IN LIGHT OF ,0
train_3548,From today we will take a question from a member of the public at the daily press conference Ask your,1
train_3549,Maybe because it wasn t a LOL,1
train_3550,Bayelsa records its index case of,1
train_3551,Along with this it s the most 90s looking team jersey and I love it pic twitter com TZ8KdezmIF,0
train_3552,This series of tweets and the frightening gap in time between all three must be posted on EVERY electronic billboard and,1
train_3553,There s something really creepy about all those Lib Dems who are fasting in solidarity with Muslims It s the worst kind,0
train_3554,Pennsylvania Forced To Remove Hundreds Of Deaths From Death Count After Coroners Raise Red Flags Th https,1
train_3555,The President will address the nation on key issues surrounding the fight against  in Uganda Tune in to,1
train_3556,if anyone wants to dm and talk abt dogs and cute animals and send stupid pictures to eachother i m down,0
train_3557,Boil EUCALYPTUS leaves in tightly covered pot filled with water then remove the pot from heat to inhale the vapors It is not a vaccine of but it can decrease the death rate,1
train_3558,Lazzari I ll be talking sports w Tues AM at 6 50,0
train_3559,If you want to know one thing about Cesar Ruiz one thing that might explain why the Saints became so enamored with him,0
train_3560,Help make better from the comfort of your home The release candidate of Python 3 8 3 is out Give it a spin will ya All rightthinking people in this country agree,0
train_3561,If we want life to approach anything like normal anytime soon we need a comprehensive testing program It s not going to,1
train_3562,Never stop training Bon ramadan,0
train_3563,This Palestinian man who owns a restaurant in Deir al Balah city in central Strip distributes free meals to the publi,0
train_3564,Probably the most significant is the fact that in this month as we are told by Allah the gates of Heaven are thrown o,0
train_3565,The Nato general Tod Wolters told reporters earlier this month that he was chiefly concerned about the presence of Russian military staff in Italy It is of concern I pay very close attention to Russian malign influence he said,1
train_3566,My Folding Web Control jumps to 99 99 and stays there If I reboot it is at 18 as it should but then it jumps to 99 99 again I use Windows Vista 32 bit and Chrome 49 FahControl doesn t start gives some Python error Maybe it works anyway but can I fix,0
train_3567,God bless me too for this Ramadan 0476773407 GTB,0
train_3568,We have taken a decision if a person is tested positive for and he has provision to isolate himself at his residence the person can home quarantine himself Lakhs and lakhs can t be quarantined govt has its own limit West Bengal CM Mamata Banerjee,1
train_3569,I m disappointed my wife isn t as excited about my new with 64gb of as I am The nerve of her,0
train_3570,peruzzi First 100 people to retweet gets 5k each If it s too small for you don t participate we need only those people who genuinel,0
train_3571,FIFA has proposed allowing teams to make up to five substitutions per match to help players cope with the return to action,0
train_3572,SA Will it be safe for learners to knock off at school around 17 30 during this  and on top of that during winter,1
train_3573,When will the UK lockdown end,1
train_3574,FIFA has proposed allowing teams to make up to five substitutions per match to help players cope with the return to action,1
train_3575,Tocilizumab improves significantly clinical outcomes of patients with moderate or severe  pneumonia APHP,1
train_3576,Happening in less than 1 hour there is still time to register NOW for this important webinar,1
train_3577,Around 96 Doctors amp 156 nurses have tested positive for in India campaign for Rs 51 donation is to give an o,1
train_3578,Canada s top doctor warns against relying on to reopen the economy as Premier co,1
train_3579,Best Ai generated memes pic twitter com 8laZ4OJuLu,0
train_3580,RN With reference to the latest RBI circular on Repayment moratorium for Credit Cards amp Loans we request you to refer detailed information available on our website Link attached,1
train_3581,He is not a true believer who eats his fill while his neighbour is hungry Prophet Muhammad PBUH,0
train_3582,You ve Been Served Recipes to welcome Ramadan,0
train_3583,Allah made the smell from the mouth of a fasting person more fragrant than the scent of musk MercyOfAllah,0
train_3584,Well the cat is out of the bag now,0
train_3585,TUC Honour every worker who has died from and other work related injuries and diseases on International Workers Memorial,1
train_3586,If a non Hijabi wants to put on headscarf during Ramadan so what If someone wants to stop sins during Ramadan so what If,0
train_3587,Based on the today s separate figures for England Scotland Wales and Norterhn Ireland a cautious estimate of the number,1
train_3588,is intended to be given to people newly infected with  The VA study gave it to people alread,1
train_3589,India Center has advised the States that except for dedicated hospitals other hospitals should continue to provide servi,1
train_3590,It is not a month to be righteous Allah ask you to make effort with the core of your heart just MercyOfAllah,0
train_3591,farouq This thief shame no catch you You Dey talk of Ramadan The 60 of Npower volunteers that you refused to pay their March stipend nko Have shame this stupid woman,0
train_3592,For 2 weeks Kushner has been notably removed from related operations according to officials working in coor,1
train_3593,I wish I could be destroyed between big python thighs then have the pleasure of being trapped under her sexy bum crack OMG yes please,0
train_3594,Enjoy the deal and save up your money Waterproof Anti Slip Dog Cat Pet Winter Shoes is now selling at 22 99 at Grab it ASAP,0
train_3595,Opinion Trump s theory about disinfectant has a dark history in AIDS denialism,1
train_3596,A Dream Within a Dream,0
train_3597,What Impact Might  Have on Home Values,1
train_3598,Such great news Back in early March we helped sponsor a competition to use machine learning to predict effective  treatments Guess what the winning project predicted Remdesivir,0
train_3599,Russia cases overtake China as Vladimir Putin faces sharp rise in infections,1
train_3600,Opinion This Ramadan even non Muslims can help their friends and neighbours with kindness,0
train_3601,cj No offense but the disappearing before May actually sucks,1
