ID,text,target
train_0,The bitcoin halving is cancelled due to,1
train_1,MercyOfAllah In good times wrapped in its granular detail I challenge myself to find meaning and model the humility t,0
train_2,266 Days No Digital India No Murder of e learning No 2g online business No Restore in J amp k,1
train_3,India is likely to run out of the remaining RNA kits which are essential for testing in one week What is the gov,1
train_4,In these tough times the best way to grow is to learn or in my case teach to help people learn to connect Sports and Anal,0
train_5,FIFA has proposed allowing teams to make up to five substitutions per match to help players cope with the return to action,0
train_6,Lovers of sports especially do you know why sometimes the time changes All this is done in the name of Daylight Saving Time DST which is the practice of setting the clocks forward one hour from standard time during the summer months and back again in the fall,0
train_7,ig he kinda cute sometimes smh,0
train_8,Frontline health workers are critical in the fight against infectious diseases not just  They protect communit,1
train_9,Contact centers are getting overwhelmed with customer questions during  Automate providing answers to the most common questions using SearchAI Answers through a chatbot or a voice assistant Setup Search Answers in a week or less,0
train_10,Maybe one of the distinguishing features of a good leader is that they are not using this present situation as a politic,1
train_11,The BEST REWARD for any Human Being on earth now is to understand amp accept Islam Ahmadiyya May this change,0
train_12,Article New tool on how to adapt our health messaging to a specific audience especially in the current,1
train_13,Asks Chief Judge to Free Prisoners Due to  Threat via,1
train_14,It is with great sadness we announce that pharmacist Jayesh Patel has sadly died from  He was described by fri,1
train_15,Is anything more damning of this Tory government than a  death toll approaching 50 000 which they re pretending is o,1
train_16,Can someone clarify for me why we are reporting 20 000  hospital deaths when many scientists and medics belie,1
train_17,The mayor of Osaka Japan s third largest city is facing a public backlash after he suggested men are better suited to,1
train_18,The is a labor of love for Check out how he got his start right here,0
train_19,An EU report about Chinese and Russian disinformation on was watered down after pressure from Beijing,1
train_20,Bayelsa records its index case of,1
train_21,Are bureaucrats taking advantage of PMs total engrossment with Pandemic Today Tarun Bajaj has been made Secy Eco,1
train_22,O ye who believe fasting is prescribed for you as it was prescribed for those before you so that you may become righteous,0
train_23,To bake more fun for you in here we are with Here s a Hint to make it more interesting You u,1
train_24,I am praying that abounding joy will undoubtedly discover you as you are walking down the street Ramadan Mubarak,0
train_25,since it s the beginning of Ramadan for our fellow Muslim ARMYs please feel free to educate us by informing us of any,0
train_26,Graham is like a cat Gets the zoomies sometimes,0
train_27,Dry yer eyes mate WM incompetence has given us the highest death rate in Europe All you care about is fecking flags,1
train_28,Make Ramadan Greeting Card At Home Watch Full Videos In Youtube MercyOfAllah,0
train_29,Thx a lot for the feedback I ll stress test it a bit more then Most of the overhead in the current version is due to Python copying pixel data from Blender to numpy this should be switched to C C somehow Also I hope there is no limitation wrt texture size in Blender,0
train_30,Jenrick urges house builders to reopen sites as more announce return to work,1
train_31,Ramadan period drama with Jewish characters stirs debate in Middle East,0
train_32,com That Mufti is drunk Plus is Ramadan He should b mb himself first Oh wait DEAD MEN TELLS NO TAILS,0
train_33,I spoke to about the Industry and how he would in the face of shutting down the down touring circuit and revenues,1
train_34,The live blog is reporting Sir Patrick Vallance told briefing of science journalists that he will release nam,1
train_35,What happens when religious eating habits conflict Do you fast,0
train_36,Real fake deaths this is the kind of lies doctors being told to label EVERYTHING c,1
train_37,50 in 50 Baseball returns to Milwaukee after four year absence,0
train_38,Pls don t forget to put her in your prayers this Ramadan she s still not back,0
train_39,He was warned of the danger the beginning of January amp in next 2 months he allowed 50000 people to enter Cda from where t,1
train_40,you know france has mcdonalds and fast food too right,0
train_41,Machine learning is a success,0
train_42,This series of tweets and the frightening gap in time between all three must be posted on EVERY electronic billboard and,1
train_43,Dear tweeps My uncle called me today by his own hands o and promised to get me a laptop Ah Ni osan awe you raised my hope sir Pls make it happen or else hmm The last time one of my uncle asked for my account number last ramadan common vibes no drop,0
train_44,It s National Volunteer Appreciation Month a big thank you to our volunteers that make our events amp programs a success Weston 55 Club Friends of the Weston Library Weston Citizen Observer Patrol amp Weston Sports Alliance,0
train_45,Four weeks ago on March 26 there were 938 confirmed U S deaths Today on April 26 there are now 54 530 co,1
train_46,Padres prospect countdown No 2 Luis Pati o,0
train_47,blackstock Guia s family has set up this in her memory and has asked me to share the details with you all She was lege,1
train_48,NEW BLOG POST Recording at Home During ,1
train_49,Hello again my birthday is in 29 days and my wishes are to get a dog by then and to get completely idiotic from tequila with my friends that is all thank you,0
train_50,kudduzz Ya Allah we are battling  and hunger in the land We have wronged our souls and transgressed the limits but if you,1
train_51,Irl Millions of people in Syria live in densely populated areas including prisons internally displaced person ID,1
train_52,ENGLISH Part Of Qunoot 4th Ramadan 1441 2020 Makkah By Sheikh Sudais Complete Video htt,0
train_53,The problem with Trudeau Tam Hajdu et al is not just of competency although that is questionable The problem is that they im,1
train_54,You sound surprised Paul I m not Labour and the Lib Dems are supporting Ramadan and ignoring Easter Doesn t that t,0
train_55,ABC News crammed bellwether and three cornered contest into a sentence in a piece on Eden Monaro I had Python flashback which happens occasionally,0
train_56,Asia s mosques deserted as keeps Ramadan faithful away,0
train_57,Whether it s music photography books or cars amp sports that you re into Lock In has a podcast for you Discover new voices and learn something new Go to and transport yourself to a new world,0
train_58,Digitalization How BJP is using digital platform to conquer situation Credit goes to our legendary Organiza,1
train_59,The effects of in Africa might be seen clearly from next month We are slowly entering into that USA Italy disas,1
train_60,As an English born woman I am sick of being treated as a second rate citizen in my own country Easter was,0
train_61,Academy Join us online this Wednesday at 15 00 to discuss the impact of with High,1
train_62,The the July 26 Movement in South Africa welcomes the Cuban Doctors who arrived on the 27th of April 2,1
train_63,What are your personal action points during the  crisis Our Youth4Policy fellow arthur is sharing his inputs,1
train_64,oxford Dear 1 The UK has one of the worst death rates in the world 2 20k people have died already,1
train_65,Has a sporting mistake been scrutinised as much as this one In sports history I m genuinely curious It s like an annual holiday in the UK now,0
train_66,Calls DFFN Diffusion Pharmaceuticals Announces Pre IND Submission to the FDA of Design for TSC Trials to Treat Acute Respirator,1
train_67,I have written a letter to Mr President on  AND THE RISING INCIDENCES OF MYSTEROUS DEATHS IN KANO STATE A CALL ON,1
train_68,Say it with me Africa is a whole CONTINENT Not a COUNTRY,1
train_69,Praise Jesus Thank God Praying Praying for all Really folks That s the plan strategy solution for dealing with this bullshit Miss me with that I ll believe in thank a god when it proves itself to be real and competent as a so called all powerful deity,1
train_70,Just saw this two seconds ago now I understand why people were so angry when I praised Gates generosity Bill Gates defends Ch,1
train_71,And Now This How Deep Learning is Accelerating Drug Discovery in Pharmaceuticals Read More Here,0
train_72,Sorry for the delay on this weeks guide on python in topspin on the MADByTE things have gotten a bit out of control at the moment I will be pushing this tutorial until next week,0
train_73,I am sick No not  Ramadan is being forced down our throat we are Christians you stopped churches playing C,0
train_74,Pennsylvania Forced To Remove Hundreds Of Deaths From Death Count After Coroners Raise Red Flags Th https,1
train_75,Attempts to spin the UK response as a success are insulting Germany has a larger population but 6 000 deat,1
train_76,CONNECT Ramadan DUA DAY 4 O Allah on this day strengthen me in carrying out Your commands let me taste the sweetness of Your re,0
train_77,kanwal Material bread strengthens the body and spiritual bread sustains the soul and sharpens the spiritual faculties see,0
train_78,Prime Minister interacts with CMs to plan ahead for tackling  says impact of will re,1
train_79,Pennsylvania Forced To Remove Hundreds Of Deaths From Death Count After Coroners Raise Red Flags Th https,1
train_80,A post pandemic Cold War is developing between the United States and China but both sides are losing the ideological fight,1
train_81,AWS released Amazon SageMaker Studio earlier today as GA version in select regions Thank you SageMaker teams Studio is the game changer,0
train_82,There is no narrative promoted in sports journalism so trite and stereotypical as the black athlete emergent from vaga,0
train_83,To all my Mulsim brothers and sisters I love yall I hope you re having a beautiful Ramadan and if I ever catch somebody i,0
train_84,PM releases details of end to lockdown May 4 manufacturing construction amp wholesale for cons,0
train_85,New upload python nbxmpp 0 9 95 20020429 5303bb12 1 by Martin into experimental,0
train_86,Chinese citizens could avoid Australian products and universities if Prime Minister Scott Morrison doesn t stop calling for a,1
train_87,What will the media say if Georgia sees no drastic uptick in hospitalizations or deaths after opening,1
train_88,Let s only hope 400 will give balls to show their place They have caused,1
train_89,Ramadan Mubarak Black Women Dipped in Gold,0
train_90,Sarah Hoyt observes responds Well it s the only in history to cause us to damage ourselves more than any enemy in any war has managed,1
train_91,Over 75 000 paid viewers from across the world tuned in to watch s LIVE concert even as fans debated wide,1
train_92,Ramadan Mubarak Black Women Dipped in Gold,0
train_93,The seems to have miraculously cured all other diseases People only die of now,1
train_94,DAY6 s sold items on SBS Hope TV Celeb Market to raise funds for relief operations Sungjin s bag 500 000 wo,1
train_95,May you and your family be blessed with good health and happiness Happy Ramadan Team,0
train_96,Interpal is one of the leading charities providing aid to Palestinians It is completely legal and above board in Britain Coming in Ramadan this is an especially heavy and bitter blow Read Jan Westad s and my exclusive report in Middle East Eye below,0
train_97,HafsatAbdul You know why we are all so happy in Ramadan Because for one month in a year we are all doing what we were created to,0
train_98,Robert E Lee s Shannon looks to build on strong freshman softball season at FMU via,0
train_99,The pandemic is going to take a greater toll on the conservative electorate leading into this election and that s simply ju,1
train_100,Are bureaucrats taking advantage of PMs total engrossment with Pandemic Today Tarun Bajaj has been made Secy Eco,1
train_101,This beautiful and blissful Ramadan I want the entire humanity to be safe happy and peaceful MercyOfAllah,0
train_102,On Tuesday 28 April at 11am please stand in a minutes silence for all workers who have lost their lives during this,1
train_103,GitHub nosy b holography A small demo using WebXR and Deep Learning to create Holograms of people,0
train_104,akin1 Four Nigerian States without in Nigeria 1 Kogi 2 Yobe 3 Nasarawa 4 Cross River Those Governors shoul,1
train_105,Hey just in case you re keeping score Christians were not allowed to attend church for a few hours on Easter Sund,0
train_106,FIFA has proposed allowing teams to make up to five substitutions per match to help players cope with the return to action,1
train_107,BREAKING Another 413 UK deaths reported in past 24hrs New total of 20 372 does not include many 1000s more,1
train_108,So it isn t just entry level jobs they are stealing Could you imagine how huge a benefit they would have been to their own nation,0
train_109,All of American society is engaged and mobilized in the war against the invisible enemy While we must remain vigilant it,1
train_110,Burned by briefings Trump sulks from a distance,1
train_111,As I told earlier today at the White House rocket scientists do amazing things even when working from home Wat,1
train_112,bahnassy Ramadan Kareem dear Rania Thank you so much Much blessing and health for you God bless you http,0
train_113,MercyOfAllah It Ramadan is the month whose beginning is mercy its middle forgiveness and its end release from,0
train_114,Senegal developed one of the world s most affordable testing kits which costs 1 each 60 3D printed ven,1
train_115,The Best Cat Breed for You Based on Your Personality Type,0
train_116,Lunch Boxs Food Prep 3 Compartment Breakfast Lunch Dinner Airtight Sotorage C via,0
train_117,After a long journey from Kota 391 children are back with smiles amp cheers To ensure they amp their families remain safe,0
train_118,Will Cuomo be held to account,1
train_119,There is growing concern that a serious new related condition may be emerging in children,1
train_120,Jonah was one of the first people I followed on Twitter but the endless anti Trump posts got to be too much Miss the dog vids though,0
train_121, PDP to Buhari s govt why do want to poison Nigerians with expired rice as palliative we wonder how a g,1
train_122,Do you need bowls of your favourite soups and stews to stock up for SAH R Let help Our efficient and well trained dispatchers will deliver it to u in no time Lockdown does not have to stop you cash,0
train_123,This Ramadan I will pray for two things a lot 1 Elimination of 2 Mental stability and end of stunted grow,0
train_124,Malaysia to boost  testing to over 22 000 daily by next week Dr Noor Hisham,1
train_125,Unconditional generosity is ingrained in the DNA To contribute to the fight against our new government i,1
train_126,NYT s analysis of Trump s remarks about the By far the most recurring utterances from Mr Trump in the briefings,1
train_127,I want to take this moment to wholeheartedly thank the Telangana police force for spearheading the battle against,1
train_128,Is this Man City round two as more Saudi money looks set to enter the Premier League,0
train_129,To follow my blog for latest news in politics sports entertainment crime etc pls click the link below,0
train_130,Sounds positive I hope it is as will give us all hope for a slow way out NZ wins battle against community transmission,1
train_131,The UK has the world s 29th largest population The 32nd greatest population density The 6th biggest GDP The 35th mos,1
train_132,NJ Gov Phil Murphy acknowledges his state is broke but wants to give illegal immigrants 600 per week during the Coronaviru,1
train_133,American Oversight has filed two lawsuits against the Trump admin for failing to release records related to the federal g,1
train_134,BREAKING NYC hospitals exposed for endlessly murdering patients on purpose amp covering it up MAKE THIS,1
train_135,We ve extended the deadline for paper proposals for the September conference to May 4 and added info o,1
train_136,Given you have such a huge Indian community you should be representing please can you tell me why Keir ignored them at the BAME meet recently A response would be a welcome change assuming you have nothing to hide and truly represent Indians as well,1
train_137,If their was a democratic in the white house  would have never made it to the news,1
train_138,DAY6 s sold items on SBS Hope TV Celeb Market to raise funds for relief operations Sungjin s bag 500 000 wo,1
train_139,It s family first for one of the newest Miami Dolphins players,0
train_140,Common sense Really You told people to shoot BLEACH you raving lunatic,1
train_141,CRPF Commando Chained At Police Station For Allegedly Not Wearing Mask via,1
train_142,That blasted is in for a shock a 1 2 mile wide asteroid is heading towards Earth True its current trajectory means i,1
train_143,Drinking is the only social activity that Kenyans know and it s sad,1
train_144,Eu gostando da aula de computational thinking using python WHATTTT,0
train_145,FIFA has proposed allowing teams to make up to five substitutions per match to help players cope with the return to acti,1
train_146,Freed of briefing duty wounded Trump airs full collection of grievances on Twitter retweeting claim of coup attempts,1
train_147,Once again uses its economic clout to force other nations to kowtow to After covering up the early,1
train_148,British Hindus excluded from Labour s roundtable examining impact on BAME via,1
train_149,FIFA has proposed allowing teams to make up to five substitutions per match to help players cope with the return to action,1
train_150,My dog totally headbutted my teeth lip super so hard rn as i am barely waking up ugh,0
train_151,Me writing simple python for loops and if statements in my living room My mom Thinks I m a deep web hacker,0
train_152,cats are the greatest creatures on earth sorry I don t make the rules,0
train_153,New gradual easing of measures via,1
train_154,More people have died from  than the war you dodged 5 times,1
train_155,What are companies like Intel IBM and Cushman amp Wakefield planning to change as they prepare for employees to return to the o,1
train_156,Three  patients are on the run in Kano This is according to Coordinator of Kano Taskforce on  Dr Tijjani,1
train_157,I am sick No not  Ramadan is being forced down our throat we are Christians you stopped churches playing C,0
train_158,Dear sir not all Indians are with their families at a time when they must be Help us unite with our families,1
train_159,So we have 3 weeks left My kids in 3rd grade He s passing No sports riding on it Can we just stop doing work and it ll,0
train_160,From Wash Times Fauci style is being used as a tool to implement a privacy destroying government system o,1
train_161,When Boris Johnson labels the government s approach to a success what is his measure,1
train_162,Edwards stay at home order issued to stem the spread of the expires April 30,1
train_163,Dang Notorious spyware company NSO Group is marketing tracking in US according to Time to go CSI,1
train_164,No unnecessary Yes I talk to my dog,0
train_165,Upon further review Eagles drafting of Jalen Hurts was as silly as it seemed David Murphy,0
train_166,If you feel that you are being put at risk with inadequate PPE at work it is important that you let us know Our advice team ar,1
train_167,Pandemic Food Assistance pic twitter com UfxtizbcPm,0
train_168,SLTR Looking for a little bit of help If you play or have played sports including wrestling Would you mind taking a few minu,0
train_169,It was on 3rd Ramadan that Sayyidah Fatimah al Zahra left this world She is the pure one who was born in a purified land,0
train_170,Hmmmm I don t recall anyone blasting Jesus Christ Is Risen Today on Easter,0
train_171,Pleased to see policy brief on and its impacts on amp sectors in Aquaculture Magazine,1
train_172,ItsJustAsia NYC Mayor Bill de Blasio threatened to permanently close churches but he s giving Muslims half a million meals for Rama,0
train_173,com Uttar Pradesh 53 students from 3 madarsas test positive for in Kanpur,1
train_174,PCB must introduce a program of mentally grooming and educating cricketers at domestic level So when they re picked amp arriv,0
train_175,As a fellow BC I trust my fren especially with the ears down but the cat not so much Lol,0
train_176,Exclusive Analysis by finds that 31 states far short of testing levels needed for safe reopen,1
train_177,How to Use Selenium to Web Scrape with Example Scraping NBA Player Names and Salaries from Using Selenium Photo by JC Gellidon on Unsplash Selenium is a Python library and tool used for automating web browsers to do a number of pic twitter com y1AgB3B2Vf,0
train_178,In order to quickly effectively and efficiently disinfect public transport like trains boats buses and planes robotic UV,1
train_179,Social distancing and stay at home two different things,1
train_180,rabe This the first Ramadan we are locked before shaitan,0
train_181,Masha Allah Sister Ramadan Mubarak to all brothers amp sisters May Allah swt give more power heath and wealth Accepts our deeds amp duas,0
train_182,Engaging with Athletes During and After  Addressing Physical and Mental Wellbeing Podcast w,0
train_183,Thalapathy Vijay has transferred relief fund directly to bank account of Kollam Nanbans Eravipuram Unit member,1
train_184,Commission We kick start the The aim is to raise 7 5bn to develop diagnostics treatments and vaccin,1
train_185,You re going to see a resurgence of union activity Marcotte said They have the upper hand right now They re not being nasty or confrontational they re saying Our members need to be safe,1
train_186,Whats you store timing in Ramadan,0
train_187,3 Connection between Ramadan amp Quran In Marathi language,0
train_188,Clearly I am not a doctor But questions need to be asked about,1
train_189,When Karnataka sealed its borders all the chest beaters were shouting at us and now Kerala has sealed the Karnataka and Tamil,1
train_190,ym The Prophet Muhammad Peace be upon him said Whatever is prayed for at the time of breaking the fast is granted and never ref,0
train_191,Pleasure to join school leaders from across Europe today to discuss the impacts of on private educa,1
train_192,yeah this shit is aggravating,1
train_193,JeanPierre California Gov Gavin Newsom has put into immediate effect Restaurants Deliver Home Meals for Seniors a program that,1
train_194,A brand new weekly show every Monday The F1 Show brings you all the latest news updates and exclusive interviews fro,0
train_195,NJ Gov Phil Murphy acknowledges his state is broke but wants to give illegal immigrants 600 per week during the Coronaviru,1
train_196,ramadan means sending emails to my teachers like 4 10AM Hi Miss I don t think I ll make it to our 8 30AM Teams call,0
train_197,8 hour Interrogation Intimidation amp Harrassment of Journalist Arnab Goswami at NM Joshi Police Stn during the times,1
train_198,Okay I was semi joking earlier but I think I might really learn python out of spite now,0
train_199,Malaria cause of Kano deaths not  Commissioner,1
train_200,FYI when it comes to food and safety If you wanna live burn Everyrhing Nothing b or bacteria lives above 300 degree nothing So when in doubt burt it not the time for rare snythi3ng ask doctors burn it it 100 right,0
train_201,Mamta doesn t have mamta on west Bengal I think she wrote different story for the climax of,1
train_202,is similar to altitude sickness which is similar to 5G toxicity Mass electricity poisoning caused tens of thou,1
train_203,oxford Dear 1 The UK has one of the worst death rates in the world 2 20k people have died already,1
train_204,damn this dude still hanging around and saying he s leaving huh,0
train_205,Breakfast food orders surge on Grubhub during pandemic Video,1
train_206,From s on Rep Meuser shared some video of his floor speech where he blames partisan political games for delaying funding 16 26,1
train_207,WOW NJ Teacher Caught on Camera Telling Students She Hopes They Die From Nicole Griggs math teacher Stei,1
train_208,South Africa Casts Dark Shadow Over South Africa s Freedom Celebrations,1
train_209,ai s o v rias Spoiler Sherlock Chemistry View Diamond Sky Better Off Replay kimi no seide excuse me miss good evening tell me what to do 1 of 1 Prism Odd eye Love like oxygen e etc,0
train_210,RETWEET THE ROCKEFELLER FOUNDATION THINK TANK PLANNED amp WROTE THE NARRATIVE FOR THE SOCIALIST STATE,1
train_211,During Ramadan last 3 years I was in 100 level then One time like that I was broke so I asked my roommates at the ho,0
train_212,A statue of President Kennedy is a tougher amp smarter leader than,1
train_213,British American scientist Peter Daszak refutes the saying that novel came from Wuhan lab,1
train_214,Professor Ameet Talwalkar along with his team has open sourced s distributed deep learning training platform Code Article,0
train_215,on that note ramadan mubarak from ramadan rj everyone,0
train_216,There are tons of different chatbots from different sources like Google Microsoft Amazon And just recently announced a new that might be better than the one from Google See at pic twitter com l9uOXLmqSE,0
train_217,Gary he s an upper class twonk and plausible to be the focus of a Monty Python sketch,0
train_218,morin Learning online week calf amp tendon,0
train_219,not Islam Ramadan is the blessed holy month when the Qu ran was revealed to Prophet Muhammad sallallahu alaihi wasallaam by Ange,0
