ID,text,target
train_1695,WPCareySchool Donghyuk Shin left industry for academics and is one of the newest assistant professors pic twitter com rvbNTSsZRd,0
train_1696,English As Boris Johnson returns to work today let s just reflect that subsequent to the first two cases of  hitting the,1
train_1697,Even amid pandemic caste atrocities continue,1
train_1698,I am sick No not  Ramadan is being forced down our throat we are Christians you stopped churches playing C,0
train_1699,Another great resource for Engineers See this best seller pic twitter com Okxs6cgI7h,0
train_1700,Starmer she doesn t want to be aware,1
train_1701,O Allah give us all the ability to keep the 30 fasting of this holy ameen,0
train_1702,It s an ideal place to invest if you re looking to earn lots of cash online Join me for Part 1 of my live forex training series on  Response,1
train_1703,ENGLISH Part Of Qunoot 4th Ramadan 1441 2020 Makkah By Sheikh Sudais Complete Video htt,0
train_1704,BUSINESS UPDATE ICYMI Navigating the housing market in  times Click,1
train_1705,As many as 700 new cases of amp around 12 related deaths were reported in y day as the country entered the 2nd day of The number of cases in the country reached 13 699 with Punjab leading the tally with 5446 cases which s the highest among all provinces,0
train_1706,Clearly I am not a doctor But questions need to be asked about,1
train_1707,Saving One Life Is As If Saving Whole Of Humanity Quran 5 32 Tablighi members who have recovered pledge 2 donate plas,1
train_1708,MercyOfAllah Allah does not bestow His mercy except on the merciful among His slaves Al Bukhari,0
train_1709,Does dog think u r couch,0
train_1710,Meanwhile we have almost more deaths here than American casualties from the Vietnam war,1
train_1711,Saving One Life Is As If Saving Whole Of Humanity Quran 5 32 Tablighi members who have recovered pledge 2 donate plas,1
train_1712,Alex hope you get help I m struggling too Single mother of one and also took in my nephew so 3 year old and 5 year old No tp No cat food Boy and we re on our last box of mac n cheese tonight Praying unemployment comes in Praying you get help Sending love your way,0
train_1713,Hassan786 Under aswjpak 3 Ramadan will be Youm e WisaL by Syeda Fatima throughout the country using this hashtag to pay trib,0
train_1714,dude have been looking at myself very hard for over a yr now using tools most could not handle u would not believe me if I told you exactly how I faced my demons found hard truths such as this very sad truth u highly underestimate power of tyrants mind control,0
train_1715,around the world believe that teaches them to practice their It gives us a lesson of becoming more self disciplined self controlled show more empathy towards less fortunate ones and give more,0
train_1716,Bill Gates Says His Foundation Is Abandoning Other Initiatives To Focus 100 On Zero Hedge Show us the le,1
train_1717,The Algerian authorities must urgently halt arbitrary prosecutions aimed at silencing Hirak activists and journalists amid the  pandemic All targeted by these sham trials to be released immediately,1
train_1718,I m the author of alive progress a new kind of Progress Bar for python like you ve never seen with real time throughput eta and very cool animations It s also very easy to use and feature packed take a look,0
train_1719,Deep Learning Chatbot Everything You Need to Know,0
train_1720,The 100 Most Popular Online Courses of All Time 2020 pic twitter com 097ErdlkEF,0
train_1721,Our Emergency Wage Subsidy portal is now open to accepting applications for all Canadian businesses impacted by,1
train_1722,com Rajdeep Sardesai lies that Punjab government received only Rs 71 crore from the centre to fight,1
train_1723,Coulda just been for Ramadan,0
train_1724,This Ramadan A sensible powerful message from,0
train_1725,English for Career Development Algorithms Part 1 Introduction to TensorFlow for Artificial Intelligence Machine Learning and Deep Learning What is Data Science,0
train_1726,NYC Mayor Bill de Blasio threatened to permanently close churches but he s giving Muslims half a million meals for Ra,0
train_1727,For a sports starved audience ESPN s 10 part documentary series on Michael Jordan s final season has offered,0
train_1728,NATIONAL NEWS  Spaza shop owner or general dealer Here s where how to apply for support The scheme benef,1
train_1729,My guesses on tomorrow s WWE Games announcement WWE 2K Playgrounds New mobile game New WWE 2K20 DLC,0
train_1730,3 journalists from The New York Times reviewed more than 260 000 words spoken by President Trump during the pandem,1
train_1731,Murder Burglary Soars in New York City During Lockdown via What did thi,1
train_1732,I knew had been a terrific athlete at U D Jesuit in Detroit then played baseball for former MLB outfielder Chuck Hinton in college at Howard Did NOT know he d played hawkey too eh Will ask him on our No Filter Sports Podcast about that today Thanks,0
train_1733,Who s they If they want to reduce population 200k isn t making a dent has worsened economic issues Sorry but I don t believe there is a them,1
train_1734,There is They have a leader Perhaps food for thought for my dear Anerican friends But stay safe and good luck,0
train_1735,CIS wishes everyone a blessed and prosperous Ramadan zetimi,0
train_1736,How cool Seunggi was a special guest announcer for SBS Sports News,0
train_1737,THREAD 1 20 in which I present evidence for the continuation of school closures Summary children can infect others som,1
train_1738,Michael Ryan chief executive director of the WHOs health emergencies said that India had tremendous capacity to de,1
train_1739,The invader s impact SARS CoV 2 lands in the lungs and can do deep damage there But the or the body s respons,1
train_1740,The biggest scam aftr demonet is No audits or accountability Crores donated to this fund amp even forceful s,1
train_1741,Keeping the Team and Your Sanity Together in an Interrupted Sports Season,0
train_1742,Ladies amp Gentlemen don t miss this special session of Physical Exercises on on Tuesday 28th April,0
train_1743,fasting from haircuts this Ramadan as well,0
train_1744,PCB must introduce a program of mentally grooming and educating cricketers at domestic level So when they re picked amp arriv,0
train_1745,To be honest The naps in Ramadan bang differently,0
train_1746,Sweden is beating by letting it run its course quickly so herd immunity develops quickly,1
train_1747,Stardew Valley Episode 4 Again,0
train_1748,Eight years old Eishal shot and killed by her uncle in Her fault was making noise on the floor during a game,0
train_1749,Rapid test kits were sold at a profit of 145 This is a testimony to Modi Govt s insensitivity to people s plight Its shockin,1
train_1750,729 The month of Ramadan is the month in which the Qur an has been sent down as guidance for mankind containing clear signs,0
train_1751,Did you listen to doctor on Thursday briefing,1
train_1752,Seyi Makinde is handling the  situation well in Oyo with little or no Federal assistance Why is Ganduje crying,1
train_1753,I hated Reggie Miller with a passion Not like a Karl Malone hate Just a regular sports hate,0
train_1754,Wireless Bluetooth BT Beanie BlackHat Wireless 3 0 Hands Free Knit Music MP3 Built in Microphone Speakers Cap Rechargeable USB Winter Fitness Outdoor Sports Unisex Gift Fashion Technology,0
train_1755,Is stroke and related,1
train_1756,The boss of aeroplane maker Airbus has warned that it is bleeding cash at an unprecedented speed and that its survival is un,1
train_1757,Professor Ameet Talwalkar along with his team has open sourced s distributed deep learning training platform Code Article,0
train_1758,Doctors are our frontline soldiers in the fight against pandemic My respect amp salute 2 them,1
train_1759,Thousands of people are dying daily due to amp other diseases No one knows when will he die Today it s someon,1
train_1760,MercyOfAllah However the purity of intention is stressed here as well Only those prayers will be heard which are,0
train_1761,Long expected but now made official PM Egypt to seek a new IMF loan A 12 billion agreement the largest in Egypt s history,1
train_1762,Harry Maguire has been named as Manchester United s MVP for the 20 20 season by Sky Sports,0
train_1763,Trump Has Congratulated Himself 600 Times During Briefings Says Report via,1
train_1764,Poem 29 for Blue Moon and Northern Star written by a fork of s GPT 2 language model,0
train_1765,WNBA players new contract addresses many of the inequities that plague women s sports including a new policy,0
train_1766,20 years ago 4 27 00 Joe Greene to present Dan Rooney at Hall of Fame induction,0
train_1767,75 of health care in India is provided at private hospitals So how Indias 77 of Unorganized Sector Labourers are go,1
train_1768,Fraud counterfeiting amp corruption New IIF staff paper outlines examples of illicit finance activities that are growing increasi,1
train_1769,If you see your Muslim brother sister changing from their bad habits during Ramadan please do not call them names or remi,0
train_1770,Here s your chance to develop your Ventilator prototype to help patients affected by  Send in your entries to https,1
train_1771,I thought in this quarantine all sports were canceled but somehow he still plays games,0
train_1772,As a number of states have begun to loosen stay at home restrictions business owners are grappling with when to reopen and how to,1
train_1773,Interesting story from on what sports stadium seating could look like post pandemic Teams might have make renovations like physically removing seats or installing railings to separate people,0
train_1774,Attempts to spin the UK response as a success are insulting Germany has a larger population but 6 000 deat,1
train_1775,MercyOfAllah The month of blessings Barkat and forgiveness is coming your way take advantage of it as much as you can,0
train_1776,This just shows people that there is hope An 86 year old grandmother from Dublin has received an emotional guard of honour,1
train_1777,UK Removes China From Official  Statistics Over Wonky Death Toll,1
train_1778,Dogs sniffing each other s butts when they meet is like journalists saying Oh I know your byline,0
train_1779,Would love to speak to Muslim women who have reverted since last Ramadan and are experiencing their first Ramadan this y,0
train_1780,harry i can t its Ramadan,0
train_1781,DAY6 s sold items on SBS Hope TV Celeb Market to raise funds for relief operations Sungjin s bag 500 000 wo,1
train_1782,Right that s not funny a few suggestions Howard the Duck Captain Ron Monty python,0
train_1783,Have you washed your hands Don t forget its not over yet,1
train_1784,AAML President Susan Myres weighs in on couples who may be struggling with their support agreements and alimony as a result,1
train_1785,Really And here I was thinking that they are so lucky,0
train_1786,Dominic Raab says the 20 000 death toll would have been much worse without the government s measures Well,1
train_1787,To be honest The naps in Ramadan bang differently,0
train_1788,There s something really creepy about all those Lib Dems who are fasting in solidarity with Muslims It s the worst kind,0
train_1789,tweeted this while fully unconscious,0
train_1790,All the Commissioners in Akwa Ibom State executive council are in good and sound health conditions and helping the state Co,1
train_1791,The proud tradition of army food,0
train_1792,Are you a diabetic and have questions about how to manage yourself during this Click on the link below,1
train_1793,There may be a zombie cat,0
train_1794,As a number of states have begun to loosen stay at home restrictions business owners are grappling with when to reopen and how to,1
train_1795,have u lot forgot that it s Ramadan,0
train_1796,Hospital Administrators US Physicians Healthcare Workers For Personal Protective Equipment in  Pandemic Sign the Petition via,1
train_1797,And newspapers are begging us to go out and buy them because they are being hit hard from  when they pull shit like this no one in their right mind would buy a paper,1
train_1798,All I could hear was boots and cats and boots and cats,0
train_1799,first of all your cats are the cutest You are coool Alya and i am glad i have you on my snapchat cuz i love your snaps 3 especially the cats,0
train_1800,With Italy announcing return to training for pro sports German Bundesliga looking to return and UFC returning some glimmers of light for sport It will be a while until crowds return though,0
train_1801,Don t let seniors care in Canada become a private equity money maker,1
train_1802,It s been a bad weekend for cakes and their bakers boy Ramadan wins,0
train_1803,Rock Hill s Hankins chooses college,0
train_1804,Gov Doug Ducey s Good Samaritan order raises the bar for families to sue over  in nursing homes from negligence to,1
train_1805,Johnson is correct not to rush to lifting lockdown Boris is correct to seek to avoid a 2nd wave of Pity he put,1
train_1806,didn t attend the meet on issue A case of arrogance amp his incompetency to unders,1
train_1807,How is your day afternoon or night going Savannah,0
train_1808,Golf has got to be one of the safest sports under the current circumstances Here s what three leading infectious diseas,0
train_1809,There is no room for complacency as far as dealing with  is concerned,1
train_1810,sports that me and my family play lt 33 mom volleyball amp basketball dad basketball volleyball badminton baseball golf li an,0
train_1811,If you have used deep learning applications what is deep learning,0
train_1812,Meanwhile more than 133 5 million was spent on stress reduction through things like yoga line dancing drumming,1
train_1813,I don t know who needs some cat smiling memes turned into hilariously lame dad jokes but here you are You re welcome,0
train_1814,Prices below zero are the market s way of telling producers to stop pumping now,1
train_1815,O Williams Release the past so endings pave way to new beginnings Focus on hope amp opportunity that will strengthen your resolve in starting new ventures,0
train_1816,NBA seeks stimulus package for broadcast media NBA prez writes to Demands increase in advt rates by 50 Says outstanding advt dues from govt is 64 49 crore since 2010 requests clearing all dues,1
train_1817,Epidemiologists are people too We have friends amp family we want to see I had a Disney trip canceled I have plans thi,1
train_1818,The Department of Health reports that out of 1 329  tests in Sevier County 45 were positive and 25 patients hav,1
train_1819,But they end up getting into a cat fight and so the dragon catches the bouquet instead The Gingerbread man has been mended somewhat and now has one leg and walks with a candy cane cane Shrek and Fiona walk off as the rest of the guests party and Donkey takes over singing The Song,0
train_1820,Great editorial in the Washington Post by ESFL s friend Will Jones History professor at the University of Minnesota,1
train_1821,ynwa Can t wait to wake up and spend another day without looking forward to live sports or eating venues outside my home or car,0
train_1822,I say a permanent change is in order exposing or being exposed to Ramadan Breath no longer haunts me during this holy month,0
train_1823,Cuomo was indignant over s remarks but Should bailouts for be used to rescue Democratic states l,1
train_1824,python skills put to good use pic twitter com O6bYb9QHzn,0
train_1825,WHO appears to have shown remarkable deference to the Chinese government throughout the crisis I ve joined,1
train_1826,For all the technical jargons and selective use amp interpretation of data the HARD FACT is the rate of growth of,1
train_1827,Senegal has developed a 1 test kit and 60 3D printed ventilator Madagascar launches Africa s first cure for  a,1
train_1828,The boss of aeroplane maker Airbus has warned that it is bleeding cash at an unprecedented speed and that its survival is un,1
train_1829,New  testing sites for this week,1
train_1830,C HTML Perl PHP Java Javascript Groovy Python Typescript Go Most used today still Java,0
train_1831,Today was the 4th interaction with CMs We continued discussions on  containing strategy as well as aspects relat,1
train_1832,UPDATED Speaking on the spate of mysterious deaths in Kano city Dr Hussain noted that the Kano State Technical Response,1
train_1833,Regularly washing your hands is an easy way of helping to stop the spread of,1
train_1834,Are bureaucrats taking advantage of PMs total engrossment with Pandemic Today Tarun Bajaj has been made Secy Eco,1
train_1835,cj No offense but the disappearing before May actually sucks,1
train_1836,Three patients in Kano flee after testing positive Official via 24liveblog,1
train_1837, restrictions now being slowly lifted here in Western Australia Our government were proactive and shut borders,1
train_1838,Players The point of HS sports isn t getting a college scholarship It s learning cooperation loyalty communication b,0
train_1839,I keep telling you the research is there and they have warranted further studies No absolute determinations just that NICE recommends HC for treatment and you have no space to say this drug has been unproven Yet you can t bring yourself to stop,1
train_1840,Tokyo reports fewest new cases in 4 weeks calls for vigilance,1
train_1841,Last time my code wasn t printing because I didn t specify the table s size in its declaration which is stupid Python will never do me like this,0
train_1842,Also let this be normal outside of Ramadan The burden of household chores does not go away when it s not Ramadan Wh,0
train_1843,Yesterday night Mumbai Bandra Reclamation Shot by an exhausted Doctor returning home He asked me is this why we are,1
train_1844,3 journalists from The New York Times reviewed more than 260 000 words spoken by President Trump during the pandem,1
train_1845,Obama administration asked for funding to prepare for future outbreaks Republicans said no,1
train_1846,Moise Kean set to be fined 100 000 by Everton for irresponsible lapdancer party https,0
train_1847,As you grow older you will discover that you have two hands One for helping yourself the other for helping others Audrey Hepburn,0
train_1848,Me Stay 6 feet away from me at all times and if you breathe on me I ll kill you Them Cause of the Me,1
train_1849,Stop trying to get me to watch Tiger King I already have to watch one bottle blonde from reality TV And the other reason I,1
train_1850,DAY6 s sold items on SBS Hope TV Celeb Market to raise funds for relief operations Sungjin s bag 500 000 wo,1
train_1851,If you re not old with underlying health conditions or live in the NYC area you have GREATER than 99 99 odds of not dy,1
train_1852,It is impossible to imagine effective responses to the if we did not have the WHO leading the international effort,1
train_1853,Australia rejects Chinese economic coercion threat amid planned probe,1
train_1854,Wazobia FM Kano Did you do autopsies Kano State s  Team Kano tradition and religion doesn t encourage autopsy,1
train_1855,China s ambassador in Australia has warned that demands for a probe into the spread of the could lead to a consumer bo,1
train_1856,HMRC changes salary sacrifice guidance,1
train_1857,Every journalist should read this thread and take note,1
train_1858,The way she says like it s goodbye,1
train_1859,naka Senegal is leading in Africa in the fight against Madagascar used umhlonyane to cure can we,1
train_1860,Care and Nursing Magazine features our physiology experts advice for pre op patients to use to get fit while the,1
train_1861,the bundle is featured in main page,0
train_1862,The computer algorithm that was among the first to detect the outbreak,1
train_1863,MercyOfAllah Allah does not bestow His mercy except on the merciful among His slaves Al Bukhari,0
train_1864,Day 39 all parks remain closed ,1
train_1865,Death of Jean Philippe Ruggieri CEO of Nexity,1
train_1866,Millions and millions of Americans tune in each day to hear directly from President and appreciate his leade,1
train_1867,s briefings are showing the bias and disrespect the media directs at the President Almost,1
train_1868,Training Video What Happened To Victim In China Voicetv Nigeria via,1
train_1869,See that bump That s definitely a bobcat In the style of bigfoot photography a ranger took this picture which they claim is of a big cat Have you ever taken a photo of something cool and no one believed your claim pic twitter com 9WTxsbXCGv,0
train_1870,after 16 years of giving my dog a bath today was the first time he was chill I sang buy you a drink while I was washing him,0
train_1871,We re grateful to the scientists managers data officers cleaners amp all working at the 15 molecular testing labs ac,1
train_1872,Evil Right in front of our eyes It s worse than standing idly by USDA let millions of pounds of food rot while food ba,1
train_1873,We have taken a decision if a person is tested positive for and he has provision to isolate himself at his residence th,1
train_1874, has brought many challenges to our economy To deal with this PM Ji s Gov has taken many prompt decisi,1
train_1875,Sure no more privacy concerns here rework tracking tech to address concerns via,1
train_1876,If you ever wondered why President Trump has had enough of the press briefings Take a look,1
train_1877,In an exclusive interview with Sky Sports Chelsea teenager Billy Gilmour reveals his footballing inspiration gives an in,0
train_1878,Top scientists Halt the destruction of or suffer even worse pandemics chairs,1
train_1879,silenced Of course Trump will rebuild the economy He s the only one with experience thats done it already He got us past the Ob,1
train_1880,Can you guess which Seattle sports star I zoomed with this weekend,0
train_1881,My friend who works at Walmart came to me and said how do I buy oil,0
train_1882,Alhamdulilah for the timing had it not been for Ramadan the TL would be even more messy,0
train_1883,Four weeks ago on March 26 there were 938 confirmed U S deaths Today on April 26 there are now 54 530 co,1
train_1884,Chill Todd all that fast food isn t good for u,0
train_1885,The transcripts show striking patterns and repetitions in the messages he has conveyed revealing a display of preside,1
train_1886,Dear thank you for the ability to order an SUV and have it brought to Cameron Frye s home during a,1
train_1887,pasdesoucis me running through the church after leave,1
train_1888,1 Hyperbole is a thing I understand they re not friends Learn to read with nuance 2 If you can t even bother to TRY to convince me enjoy trying to convince the tens of millions of non voters to turn out for your guy 3 How much time have you put in making calls for Biden,0
train_1889,pandey This is a india quarantine centre in Agra UP These visuals depict a scramble for essential supplies from behi,1
train_1890,How can you not admire Julia Barretto Thank you for building Emergency Quarantine Facility for,1
train_1891,So we have used a four week lockdown to test a grand total of 10918 samples for in Please note,1
train_1892,Gurria We just updated our data on Diagnostic Testing for  revealing significant scaling up of efforts in many countr,1
train_1893,advice for women menstruating during Ramadan thread,0
train_1894,Niyo With NFL Draft in the books Lions turn their attention to the unknown via,0
train_1895,heeeeeeeej has anyone ever heard of Ramadan Shukri,0
train_1896,Abrams Hearing Boris Johnson describe his Govt s strategy as a success made my blood boil On what measures is it,1
train_1897,UMW Men s Tennis Ranks 15th in Final ITA Tennis National Ranking,0
train_1898,I m pleased Mr is well recovered from amp returning to work he s lucky because by ONS,1
train_1899,The TLS is delighted to offer free advertising to independent bookstores during the  crisis htt,1
train_1900,FIFA has proposed allowing teams to make up to five substitutions per match to help players cope with the return to action,0
train_1901,Twitter just body shamed sports illustrated cover model known for being hot CHRISSY TEIGEN Men AND women calling her ugly saying she s shaped weird She built her entire career on being conventionally attractive I m doomed,0
train_1902,Me too I just drink it during sports to gain some credibility,0
train_1903,are facing demands to step up their efforts to reach vulnerable pupils following warnings that more children are being put at risk during the lockdown,1
train_1904,Trey Gowdy Our govt is punishing people for not wearing a mask yet they are 1 VOTE AWAY from letting a SERIAL KILLE,1
train_1905,Allahu Akbar A day like today 4th of Ramadan in 2017 little did i know my live was gonna change forever i lost the love,0
train_1906,Managing finances during the  pandemic can be particularly hard for those with mental health conditions Find out how we can help in this guide to Best Apps to Manage Money,1
train_1907,The situation report for 26th April 2020 has been published Our daily situation reports provide a,1
train_1908,Company owner s news commentary lt Sports gt Figure skating was the first sport at the Antwerp Olympics All the schedules are finished today In the men s singles Gillis Grafstrom 26 of Sweden who came in first in both the Compalthory and the Free Skating won the championship,0
train_1909,Emmanuel Macron amp Bill Gates Held First New World Order Virtual Meeting To Mobilize All G7 And G20 Nations In  Global,1
train_1910,Here is Imran Khan from Maple wishing Canadians Mubarak and praying for the countless selfless hours of service b,0
train_1911,Countries which implemented measures early have consistently been shown to have had the lowest deaths rates f,1
train_1912,The jersey bracket begins Two matchups today to get in to the Sweet 16 This is matchup matchup in separate t,0
train_1913,AllianzGI Artificial Intelligence Technology Opportunities Fund Reports Results for the Period,0
